BODY,STOPWORDS,LEMMATIZED,STEMMED,BIGRAMS,TRIGRAMS
i had incidents at my mammogram which were surprising and not up to the usual level of excellence at advanced radiology the first was that when i was shown to a dressing room there was a robe and package wrapper left there from the previous patient the technician took them away but it was still a little offputting because every patient likes to think that they're getting a fresh clean dressing room the second was that when i was being set up for the first picture the machine was set too high i am short ft and have very large breasts and i actually said ow loudly and told her it was too high when she tried to lift up my breast to where the plate was i told her the machine had to be lowered which she did all of the other times i've had mammograms the technician can see that i'm short and they lower the machine before we get started,i had incidents at my mammogram which were surprising and not up to the usual level of excellence at advanced radiology the first was that when i was shown to a dressing room there was a robe and package wrapper left there from the previous patient the technician took them away but it was still a little offputting because every patient likes to think that they're getting a fresh clean dressing room the second was that when i was being set up for the first picture the machine was set too high i am short ft and have very large breasts and i actually said ow loudly and told her it was too high when she tried to lift up my breast to where the plate was i told her the machine had to be lowered which she did all of the other times i've had mammograms the technician can see that i'm short and they lower the machine before we get started,I have incident at my mammogram which be surprising and not up to the usual level of excellence at advanced radiology the first be that when I be show to a dressing room there be a robe and package wrapper leave there from the previous patient the technician take they away but it be still a little offputting because every patient like to think that they be get a fresh clean dressing room the second be that when I be be set up for the first picture the machine be set too high I be short ft and have very large breast and I actually say ow loudly and tell she it be too high when she try to lift up my breast to where the plate be I tell she the machine have to be lower which she do all of the other time I ' ve have mammogram the technician can see that I ' m short and they lower the machine before we get start,i have incid at my mammogram which be surpris and not up to the usual level of excel at advanc radiolog the first be that when i be show to a dress room there be a robe and packag wrapper leav there from the previous patient the technician take they away but it be still a littl offput becaus everi patient like to think that they be get a fresh clean dress room the second be that when i be be set up for the first pictur the machin be set too high i be short ft and have veri larg breast and i actual say ow loud and tell she it be too high when she tri to lift up my breast to where the plate be i tell she the machin have to be lower which she do all of the other time i ' ve have mammogram the technician can see that i ' m short and they lower the machin befor we get start,"('i', 'have'), ('have', 'incid'), ('incid', 'at'), ('at', 'my'), ('my', 'mammogram'), ('mammogram', 'which'), ('which', 'be'), ('be', 'surpris'), ('surpris', 'and'), ('and', 'not'), ('not', 'up'), ('up', 'to'), ('to', 'the'), ('the', 'usual'), ('usual', 'level'), ('level', 'of'), ('of', 'excel'), ('excel', 'at'), ('at', 'advanc'), ('advanc', 'radiolog'), ('radiolog', 'the'), ('the', 'first'), ('first', 'be'), ('be', 'that'), ('that', 'when'), ('when', 'i'), ('i', 'be'), ('be', 'show'), ('show', 'to'), ('to', 'a'), ('a', 'dress'), ('dress', 'room'), ('room', 'there'), ('there', 'be'), ('be', 'a'), ('a', 'robe'), ('robe', 'and'), ('and', 'packag'), ('packag', 'wrapper'), ('wrapper', 'leav'), ('leav', 'there'), ('there', 'from'), ('from', 'the'), ('the', 'previous'), ('previous', 'patient'), ('patient', 'the'), ('the', 'technician'), ('technician', 'take'), ('take', 'they'), ('they', 'away'), ('away', 'but'), ('but', 'it'), ('it', 'be'), ('be', 'still'), ('still', 'a'), ('a', 'littl'), ('littl', 'offput'), ('offput', 'becaus'), ('becaus', 'everi'), ('everi', 'patient'), ('patient', 'like'), ('like', 'to'), ('to', 'think'), ('think', 'that'), ('that', 'they'), ('they', 'be'), ('be', 'get'), ('get', 'a'), ('a', 'fresh'), ('fresh', 'clean'), ('clean', 'dress'), ('dress', 'room'), ('room', 'the'), ('the', 'second'), ('second', 'be'), ('be', 'that'), ('that', 'when'), ('when', 'i'), ('i', 'be'), ('be', 'be'), ('be', 'set'), ('set', 'up'), ('up', 'for'), ('for', 'the'), ('the', 'first'), ('first', 'pictur'), ('pictur', 'the'), ('the', 'machin'), ('machin', 'be'), ('be', 'set'), ('set', 'too'), ('too', 'high'), ('high', 'i'), ('i', 'be'), ('be', 'short'), ('short', 'ft'), ('ft', 'and'), ('and', 'have'), ('have', 'veri'), ('veri', 'larg'), ('larg', 'breast'), ('breast', 'and'), ('and', 'i'), ('i', 'actual'), ('actual', 'say'), ('say', 'ow'), ('ow', 'loud'), ('loud', 'and'), ('and', 'tell'), ('tell', 'she'), ('she', 'it'), ('it', 'be'), ('be', 'too'), ('too', 'high'), ('high', 'when'), ('when', 'she'), ('she', 'tri'), ('tri', 'to'), ('to', 'lift'), ('lift', 'up'), ('up', 'my'), ('my', 'breast'), ('breast', 'to'), ('to', 'where'), ('where', 'the'), ('the', 'plate'), ('plate', 'be'), ('be', 'i'), ('i', 'tell'), ('tell', 'she'), ('she', 'the'), ('the', 'machin'), ('machin', 'have'), ('have', 'to'), ('to', 'be'), ('be', 'lower'), ('lower', 'which'), ('which', 'she'), ('she', 'do'), ('do', 'all'), ('all', 'of'), ('of', 'the'), ('the', 'other'), ('other', 'time'), ('time', 'i'), ('i', ""'""), (""'"", 've'), ('ve', 'have'), ('have', 'mammogram'), ('mammogram', 'the'), ('the', 'technician'), ('technician', 'can'), ('can', 'see'), ('see', 'that'), ('that', 'i'), ('i', ""'""), (""'"", 'm'), ('m', 'short'), ('short', 'and'), ('and', 'they'), ('they', 'lower'), ('lower', 'the'), ('the', 'machin'), ('machin', 'befor'), ('befor', 'we'), ('we', 'get'), ('get', 'start')","('i', 'have', 'incid'), ('have', 'incid', 'at'), ('incid', 'at', 'my'), ('at', 'my', 'mammogram'), ('my', 'mammogram', 'which'), ('mammogram', 'which', 'be'), ('which', 'be', 'surpris'), ('be', 'surpris', 'and'), ('surpris', 'and', 'not'), ('and', 'not', 'up'), ('not', 'up', 'to'), ('up', 'to', 'the'), ('to', 'the', 'usual'), ('the', 'usual', 'level'), ('usual', 'level', 'of'), ('level', 'of', 'excel'), ('of', 'excel', 'at'), ('excel', 'at', 'advanc'), ('at', 'advanc', 'radiolog'), ('advanc', 'radiolog', 'the'), ('radiolog', 'the', 'first'), ('the', 'first', 'be'), ('first', 'be', 'that'), ('be', 'that', 'when'), ('that', 'when', 'i'), ('when', 'i', 'be'), ('i', 'be', 'show'), ('be', 'show', 'to'), ('show', 'to', 'a'), ('to', 'a', 'dress'), ('a', 'dress', 'room'), ('dress', 'room', 'there'), ('room', 'there', 'be'), ('there', 'be', 'a'), ('be', 'a', 'robe'), ('a', 'robe', 'and'), ('robe', 'and', 'packag'), ('and', 'packag', 'wrapper'), ('packag', 'wrapper', 'leav'), ('wrapper', 'leav', 'there'), ('leav', 'there', 'from'), ('there', 'from', 'the'), ('from', 'the', 'previous'), ('the', 'previous', 'patient'), ('previous', 'patient', 'the'), ('patient', 'the', 'technician'), ('the', 'technician', 'take'), ('technician', 'take', 'they'), ('take', 'they', 'away'), ('they', 'away', 'but'), ('away', 'but', 'it'), ('but', 'it', 'be'), ('it', 'be', 'still'), ('be', 'still', 'a'), ('still', 'a', 'littl'), ('a', 'littl', 'offput'), ('littl', 'offput', 'becaus'), ('offput', 'becaus', 'everi'), ('becaus', 'everi', 'patient'), ('everi', 'patient', 'like'), ('patient', 'like', 'to'), ('like', 'to', 'think'), ('to', 'think', 'that'), ('think', 'that', 'they'), ('that', 'they', 'be'), ('they', 'be', 'get'), ('be', 'get', 'a'), ('get', 'a', 'fresh'), ('a', 'fresh', 'clean'), ('fresh', 'clean', 'dress'), ('clean', 'dress', 'room'), ('dress', 'room', 'the'), ('room', 'the', 'second'), ('the', 'second', 'be'), ('second', 'be', 'that'), ('be', 'that', 'when'), ('that', 'when', 'i'), ('when', 'i', 'be'), ('i', 'be', 'be'), ('be', 'be', 'set'), ('be', 'set', 'up'), ('set', 'up', 'for'), ('up', 'for', 'the'), ('for', 'the', 'first'), ('the', 'first', 'pictur'), ('first', 'pictur', 'the'), ('pictur', 'the', 'machin'), ('the', 'machin', 'be'), ('machin', 'be', 'set'), ('be', 'set', 'too'), ('set', 'too', 'high'), ('too', 'high', 'i'), ('high', 'i', 'be'), ('i', 'be', 'short'), ('be', 'short', 'ft'), ('short', 'ft', 'and'), ('ft', 'and', 'have'), ('and', 'have', 'veri'), ('have', 'veri', 'larg'), ('veri', 'larg', 'breast'), ('larg', 'breast', 'and'), ('breast', 'and', 'i'), ('and', 'i', 'actual'), ('i', 'actual', 'say'), ('actual', 'say', 'ow'), ('say', 'ow', 'loud'), ('ow', 'loud', 'and'), ('loud', 'and', 'tell'), ('and', 'tell', 'she'), ('tell', 'she', 'it'), ('she', 'it', 'be'), ('it', 'be', 'too'), ('be', 'too', 'high'), ('too', 'high', 'when'), ('high', 'when', 'she'), ('when', 'she', 'tri'), ('she', 'tri', 'to'), ('tri', 'to', 'lift'), ('to', 'lift', 'up'), ('lift', 'up', 'my'), ('up', 'my', 'breast'), ('my', 'breast', 'to'), ('breast', 'to', 'where'), ('to', 'where', 'the'), ('where', 'the', 'plate'), ('the', 'plate', 'be'), ('plate', 'be', 'i'), ('be', 'i', 'tell'), ('i', 'tell', 'she'), ('tell', 'she', 'the'), ('she', 'the', 'machin'), ('the', 'machin', 'have'), ('machin', 'have', 'to'), ('have', 'to', 'be'), ('to', 'be', 'lower'), ('be', 'lower', 'which'), ('lower', 'which', 'she'), ('which', 'she', 'do'), ('she', 'do', 'all'), ('do', 'all', 'of'), ('all', 'of', 'the'), ('of', 'the', 'other'), ('the', 'other', 'time'), ('other', 'time', 'i'), ('time', 'i', ""'""), ('i', ""'"", 've'), (""'"", 've', 'have'), ('ve', 'have', 'mammogram'), ('have', 'mammogram', 'the'), ('mammogram', 'the', 'technician'), ('the', 'technician', 'can'), ('technician', 'can', 'see'), ('can', 'see', 'that'), ('see', 'that', 'i'), ('that', 'i', ""'""), ('i', ""'"", 'm'), (""'"", 'm', 'short'), ('m', 'short', 'and'), ('short', 'and', 'they'), ('and', 'they', 'lower'), ('they', 'lower', 'the'), ('lower', 'the', 'machin'), ('the', 'machin', 'befor'), ('machin', 'befor', 'we'), ('befor', 'we', 'get'), ('we', 'get', 'start')"
yes you should tell patients how long the procedure will last and have a count down timer to let them know when it will end i did not hear the technicians voice when it ended also if technician talked to me while the test was happening it would have been more comforting,yes you should tell patients how long the procedure will last and have a count down timer to let them know when it will end i did not hear the technicians voice when it ended also if technician talked to me while the test was happening it would have been more comforting,yes you should tell patient how long the procedure will last and have a count down timer to let they know when it will end I do not hear the technician voice when it end also if technician talk to I while the test be happen it would have be more comforting,yes you should tell patient how long the procedur will last and have a count down timer to let they know when it will end i do not hear the technician voic when it end also if technician talk to i while the test be happen it would have be more comfort,"('yes', 'you'), ('you', 'should'), ('should', 'tell'), ('tell', 'patient'), ('patient', 'how'), ('how', 'long'), ('long', 'the'), ('the', 'procedur'), ('procedur', 'will'), ('will', 'last'), ('last', 'and'), ('and', 'have'), ('have', 'a'), ('a', 'count'), ('count', 'down'), ('down', 'timer'), ('timer', 'to'), ('to', 'let'), ('let', 'they'), ('they', 'know'), ('know', 'when'), ('when', 'it'), ('it', 'will'), ('will', 'end'), ('end', 'i'), ('i', 'do'), ('do', 'not'), ('not', 'hear'), ('hear', 'the'), ('the', 'technician'), ('technician', 'voic'), ('voic', 'when'), ('when', 'it'), ('it', 'end'), ('end', 'also'), ('also', 'if'), ('if', 'technician'), ('technician', 'talk'), ('talk', 'to'), ('to', 'i'), ('i', 'while'), ('while', 'the'), ('the', 'test'), ('test', 'be'), ('be', 'happen'), ('happen', 'it'), ('it', 'would'), ('would', 'have'), ('have', 'be'), ('be', 'more'), ('more', 'comfort')","('yes', 'you', 'should'), ('you', 'should', 'tell'), ('should', 'tell', 'patient'), ('tell', 'patient', 'how'), ('patient', 'how', 'long'), ('how', 'long', 'the'), ('long', 'the', 'procedur'), ('the', 'procedur', 'will'), ('procedur', 'will', 'last'), ('will', 'last', 'and'), ('last', 'and', 'have'), ('and', 'have', 'a'), ('have', 'a', 'count'), ('a', 'count', 'down'), ('count', 'down', 'timer'), ('down', 'timer', 'to'), ('timer', 'to', 'let'), ('to', 'let', 'they'), ('let', 'they', 'know'), ('they', 'know', 'when'), ('know', 'when', 'it'), ('when', 'it', 'will'), ('it', 'will', 'end'), ('will', 'end', 'i'), ('end', 'i', 'do'), ('i', 'do', 'not'), ('do', 'not', 'hear'), ('not', 'hear', 'the'), ('hear', 'the', 'technician'), ('the', 'technician', 'voic'), ('technician', 'voic', 'when'), ('voic', 'when', 'it'), ('when', 'it', 'end'), ('it', 'end', 'also'), ('end', 'also', 'if'), ('also', 'if', 'technician'), ('if', 'technician', 'talk'), ('technician', 'talk', 'to'), ('talk', 'to', 'i'), ('to', 'i', 'while'), ('i', 'while', 'the'), ('while', 'the', 'test'), ('the', 'test', 'be'), ('test', 'be', 'happen'), ('be', 'happen', 'it'), ('happen', 'it', 'would'), ('it', 'would', 'have'), ('would', 'have', 'be'), ('have', 'be', 'more'), ('be', 'more', 'comfort')"
your entrance to building from parking lot on corporate drive is terrible i walk to the awning that says advanced radiology only to find that i must go to the entrance that says medical arts how is that clear what if i were handicapped or it was bad weather have you not noticed this,your entrance to building from parking lot on corporate drive is terrible i walk to the awning that says advanced radiology only to find that i must go to the entrance that says medical arts how is that clear what if i were handicapped or it was bad weather have you not noticed this,your entrance to build from parking lot on corporate drive be terrible I walk to the awning that say advanced radiology only to find that I must go to the entrance that say medical art how be that clear what if I be handicap or it be bad weather have you not notice this,your entranc to build from park lot on corpor drive be terribl i walk to the awn that say advanc radiolog onli to find that i must go to the entranc that say medic art how be that clear what if i be handicap or it be bad weather have you not notic this,"('your', 'entranc'), ('entranc', 'to'), ('to', 'build'), ('build', 'from'), ('from', 'park'), ('park', 'lot'), ('lot', 'on'), ('on', 'corpor'), ('corpor', 'drive'), ('drive', 'be'), ('be', 'terribl'), ('terribl', 'i'), ('i', 'walk'), ('walk', 'to'), ('to', 'the'), ('the', 'awn'), ('awn', 'that'), ('that', 'say'), ('say', 'advanc'), ('advanc', 'radiolog'), ('radiolog', 'onli'), ('onli', 'to'), ('to', 'find'), ('find', 'that'), ('that', 'i'), ('i', 'must'), ('must', 'go'), ('go', 'to'), ('to', 'the'), ('the', 'entranc'), ('entranc', 'that'), ('that', 'say'), ('say', 'medic'), ('medic', 'art'), ('art', 'how'), ('how', 'be'), ('be', 'that'), ('that', 'clear'), ('clear', 'what'), ('what', 'if'), ('if', 'i'), ('i', 'be'), ('be', 'handicap'), ('handicap', 'or'), ('or', 'it'), ('it', 'be'), ('be', 'bad'), ('bad', 'weather'), ('weather', 'have'), ('have', 'you'), ('you', 'not'), ('not', 'notic'), ('notic', 'this')","('your', 'entranc', 'to'), ('entranc', 'to', 'build'), ('to', 'build', 'from'), ('build', 'from', 'park'), ('from', 'park', 'lot'), ('park', 'lot', 'on'), ('lot', 'on', 'corpor'), ('on', 'corpor', 'drive'), ('corpor', 'drive', 'be'), ('drive', 'be', 'terribl'), ('be', 'terribl', 'i'), ('terribl', 'i', 'walk'), ('i', 'walk', 'to'), ('walk', 'to', 'the'), ('to', 'the', 'awn'), ('the', 'awn', 'that'), ('awn', 'that', 'say'), ('that', 'say', 'advanc'), ('say', 'advanc', 'radiolog'), ('advanc', 'radiolog', 'onli'), ('radiolog', 'onli', 'to'), ('onli', 'to', 'find'), ('to', 'find', 'that'), ('find', 'that', 'i'), ('that', 'i', 'must'), ('i', 'must', 'go'), ('must', 'go', 'to'), ('go', 'to', 'the'), ('to', 'the', 'entranc'), ('the', 'entranc', 'that'), ('entranc', 'that', 'say'), ('that', 'say', 'medic'), ('say', 'medic', 'art'), ('medic', 'art', 'how'), ('art', 'how', 'be'), ('how', 'be', 'that'), ('be', 'that', 'clear'), ('that', 'clear', 'what'), ('clear', 'what', 'if'), ('what', 'if', 'i'), ('if', 'i', 'be'), ('i', 'be', 'handicap'), ('be', 'handicap', 'or'), ('handicap', 'or', 'it'), ('or', 'it', 'be'), ('it', 'be', 'bad'), ('be', 'bad', 'weather'), ('bad', 'weather', 'have'), ('weather', 'have', 'you'), ('have', 'you', 'not'), ('you', 'not', 'notic'), ('not', 'notic', 'this')"
the staff was very friendly,the staff was very friendly,the staff be very friendly,the staff be veri friend,"('the', 'staff'), ('staff', 'be'), ('be', 'veri'), ('veri', 'friend')","('the', 'staff', 'be'), ('staff', 'be', 'veri'), ('be', 'veri', 'friend')"
the staff and technician were very friendly and professional the technician made sure i was comfortable during the testing,the staff and technician were very friendly and professional the technician made sure i was comfortable during the testing,the staff and technician be very friendly and professional the technician make sure I be comfortable during the testing,the staff and technician be veri friend and profession the technician make sure i be comfort dure the test,"('the', 'staff'), ('staff', 'and'), ('and', 'technician'), ('technician', 'be'), ('be', 'veri'), ('veri', 'friend'), ('friend', 'and'), ('and', 'profession'), ('profession', 'the'), ('the', 'technician'), ('technician', 'make'), ('make', 'sure'), ('sure', 'i'), ('i', 'be'), ('be', 'comfort'), ('comfort', 'dure'), ('dure', 'the'), ('the', 'test')","('the', 'staff', 'and'), ('staff', 'and', 'technician'), ('and', 'technician', 'be'), ('technician', 'be', 'veri'), ('be', 'veri', 'friend'), ('veri', 'friend', 'and'), ('friend', 'and', 'profession'), ('and', 'profession', 'the'), ('profession', 'the', 'technician'), ('the', 'technician', 'make'), ('technician', 'make', 'sure'), ('make', 'sure', 'i'), ('sure', 'i', 'be'), ('i', 'be', 'comfort'), ('be', 'comfort', 'dure'), ('comfort', 'dure', 'the'), ('dure', 'the', 'test')"
the cleanliness wasnt at prior levels the mammogram machine that your face is forced to press up against smelled like an old ladys armpit i was really disgusted not ok should be sterilized between patients,the cleanliness wasnt at prior levels the mammogram machine that your face is forced to press up against smelled like an old ladys armpit i was really disgusted not ok should be sterilized between patients,the cleanliness be not at prior level the mammogram machine that your face be force to press up against smelled like an old ladys armpit I be really disgusted not ok should be sterilize between patient,the cleanli be not at prior level the mammogram machin that your face be forc to press up against smell like an old ladi armpit i be realli disgust not ok should be steril between patient,"('the', 'cleanli'), ('cleanli', 'be'), ('be', 'not'), ('not', 'at'), ('at', 'prior'), ('prior', 'level'), ('level', 'the'), ('the', 'mammogram'), ('mammogram', 'machin'), ('machin', 'that'), ('that', 'your'), ('your', 'face'), ('face', 'be'), ('be', 'forc'), ('forc', 'to'), ('to', 'press'), ('press', 'up'), ('up', 'against'), ('against', 'smell'), ('smell', 'like'), ('like', 'an'), ('an', 'old'), ('old', 'ladi'), ('ladi', 'armpit'), ('armpit', 'i'), ('i', 'be'), ('be', 'realli'), ('realli', 'disgust'), ('disgust', 'not'), ('not', 'ok'), ('ok', 'should'), ('should', 'be'), ('be', 'steril'), ('steril', 'between'), ('between', 'patient')","('the', 'cleanli', 'be'), ('cleanli', 'be', 'not'), ('be', 'not', 'at'), ('not', 'at', 'prior'), ('at', 'prior', 'level'), ('prior', 'level', 'the'), ('level', 'the', 'mammogram'), ('the', 'mammogram', 'machin'), ('mammogram', 'machin', 'that'), ('machin', 'that', 'your'), ('that', 'your', 'face'), ('your', 'face', 'be'), ('face', 'be', 'forc'), ('be', 'forc', 'to'), ('forc', 'to', 'press'), ('to', 'press', 'up'), ('press', 'up', 'against'), ('up', 'against', 'smell'), ('against', 'smell', 'like'), ('smell', 'like', 'an'), ('like', 'an', 'old'), ('an', 'old', 'ladi'), ('old', 'ladi', 'armpit'), ('ladi', 'armpit', 'i'), ('armpit', 'i', 'be'), ('i', 'be', 'realli'), ('be', 'realli', 'disgust'), ('realli', 'disgust', 'not'), ('disgust', 'not', 'ok'), ('not', 'ok', 'should'), ('ok', 'should', 'be'), ('should', 'be', 'steril'), ('be', 'steril', 'between'), ('steril', 'between', 'patient')"
was a very easy and stress free experience,was a very easy and stress free experience,be a very easy and stress free experience,be a veri easi and stress free experi,"('be', 'a'), ('a', 'veri'), ('veri', 'easi'), ('easi', 'and'), ('and', 'stress'), ('stress', 'free'), ('free', 'experi')","('be', 'a', 'veri'), ('a', 'veri', 'easi'), ('veri', 'easi', 'and'), ('easi', 'and', 'stress'), ('and', 'stress', 'free'), ('stress', 'free', 'experi')"
i have had several recent appointments with advanced radiology every time i am asked to fill out the same questionnaire it is redundant and waste of time,i have had several recent appointments with advanced radiology every time i am asked to fill out the same questionnaire it is redundant and waste of time,I have have several recent appointment with advanced radiology every time I be ask to fill out the same questionnaire it be redundant and waste of time,i have have sever recent appoint with advanc radiolog everi time i be ask to fill out the same questionnair it be redund and wast of time,"('i', 'have'), ('have', 'have'), ('have', 'sever'), ('sever', 'recent'), ('recent', 'appoint'), ('appoint', 'with'), ('with', 'advanc'), ('advanc', 'radiolog'), ('radiolog', 'everi'), ('everi', 'time'), ('time', 'i'), ('i', 'be'), ('be', 'ask'), ('ask', 'to'), ('to', 'fill'), ('fill', 'out'), ('out', 'the'), ('the', 'same'), ('same', 'questionnair'), ('questionnair', 'it'), ('it', 'be'), ('be', 'redund'), ('redund', 'and'), ('and', 'wast'), ('wast', 'of'), ('of', 'time')","('i', 'have', 'have'), ('have', 'have', 'sever'), ('have', 'sever', 'recent'), ('sever', 'recent', 'appoint'), ('recent', 'appoint', 'with'), ('appoint', 'with', 'advanc'), ('with', 'advanc', 'radiolog'), ('advanc', 'radiolog', 'everi'), ('radiolog', 'everi', 'time'), ('everi', 'time', 'i'), ('time', 'i', 'be'), ('i', 'be', 'ask'), ('be', 'ask', 'to'), ('ask', 'to', 'fill'), ('to', 'fill', 'out'), ('fill', 'out', 'the'), ('out', 'the', 'same'), ('the', 'same', 'questionnair'), ('same', 'questionnair', 'it'), ('questionnair', 'it', 'be'), ('it', 'be', 'redund'), ('be', 'redund', 'and'), ('redund', 'and', 'wast'), ('and', 'wast', 'of'), ('wast', 'of', 'time')"
the bathroom that patients use could use some attentionotherwise a very good experience,the bathroom that patients use could use some attentionotherwise a very good experience,the bathroom that patient use could use some attentionotherwise a very good experience,the bathroom that patient use could use some attentionotherwis a veri good experi,"('the', 'bathroom'), ('bathroom', 'that'), ('that', 'patient'), ('patient', 'use'), ('use', 'could'), ('could', 'use'), ('use', 'some'), ('some', 'attentionotherwis'), ('attentionotherwis', 'a'), ('a', 'veri'), ('veri', 'good'), ('good', 'experi')","('the', 'bathroom', 'that'), ('bathroom', 'that', 'patient'), ('that', 'patient', 'use'), ('patient', 'use', 'could'), ('use', 'could', 'use'), ('could', 'use', 'some'), ('use', 'some', 'attentionotherwis'), ('some', 'attentionotherwis', 'a'), ('attentionotherwis', 'a', 'veri'), ('a', 'veri', 'good'), ('veri', 'good', 'experi')"
dawn was great,dawn was great,dawn be great,dawn be great,"('dawn', 'be'), ('be', 'great')","('dawn', 'be', 'great')"
excellent experience,excellent experience,excellent experience,excel experi,"('excel', 'experi')",
very friendly and professional,very friendly and professional,very friendly and professional,veri friend and profession,"('veri', 'friend'), ('friend', 'and'), ('and', 'profession')","('veri', 'friend', 'and'), ('friend', 'and', 'profession')"
thank you for taking such good care of me i find comfort that i have such an amazing team to assist me,thank you for taking such good care of me i find comfort that i have such an amazing team to assist me,thank you for take such good care of I I find comfort that I have such an amazing team to assist I,thank you for take such good care of i i find comfort that i have such an amaz team to assist i,"('thank', 'you'), ('you', 'for'), ('for', 'take'), ('take', 'such'), ('such', 'good'), ('good', 'care'), ('care', 'of'), ('of', 'i'), ('i', 'i'), ('i', 'find'), ('find', 'comfort'), ('comfort', 'that'), ('that', 'i'), ('i', 'have'), ('have', 'such'), ('such', 'an'), ('an', 'amaz'), ('amaz', 'team'), ('team', 'to'), ('to', 'assist'), ('assist', 'i')","('thank', 'you', 'for'), ('you', 'for', 'take'), ('for', 'take', 'such'), ('take', 'such', 'good'), ('such', 'good', 'care'), ('good', 'care', 'of'), ('care', 'of', 'i'), ('of', 'i', 'i'), ('i', 'i', 'find'), ('i', 'find', 'comfort'), ('find', 'comfort', 'that'), ('comfort', 'that', 'i'), ('that', 'i', 'have'), ('i', 'have', 'such'), ('have', 'such', 'an'), ('such', 'an', 'amaz'), ('an', 'amaz', 'team'), ('amaz', 'team', 'to'), ('team', 'to', 'assist'), ('to', 'assist', 'i')"
